title,company,description,url
Engineering Intern ,Ducommun Incorporated,"Ducommun is looking to add an intern for its' engineering department. This position will give an engineering student an opportunity to gain real world experience in an aerospace manufacturing environment. This role will perform a variety of tasks in either Project or Manufacturing Engineering areas.

 Who are we? 

Founded in 1849, Ducommun is the oldest company in California. Starting as a hardware supply store during the California Gold Rush and eventually assisted in the birth of the aerospace industry in Southern California by providing aircraft aluminum to early aerospace pioneers like Lindbergh, Douglas and Lockheed.

Today Ducommun is a global provider of innovative manufacturing solutions for customers in the aerospace, defense and industrial markets. We specialize in electronic and structural systems, producing complex products and components for commercial aircraft platforms, mission-critical military and space programs, and sophisticated industrial applications.

Our Facility in Coxsackie, NY manufactures state-of-the-art structural components Aerospace and Defense.

Why Ducommun?


 Excellent company culture – as recognized by Newsweek’s Top 100 Most Loved Workplaces 
 Opportunity for career growth 


Job Summary


 The Intern may be responsible for reading and interpreting customers: Request for quote, contracts, purchase orders, electronic or hard copy drawings, and specifications. 
 Through the evaluation of this data, the Intern may create quotation packages, documents, drawings, and processes for the purpose of meeting customer requirements. 
 As necessary, the Intern may also be expected to support the Project/Design Engineers, Manufacturing Engineering and Manufacturing with the implementation of quotations that are awarded to the company. 
 The Intern is expected to work cooperatively as a member of an Integrated Product Team (IPT) that includes Engineering, Quality, Contracts, Finance, and Supply Chain personnel. 
 Experience utilizing CAD/3D software; CATIA preferred but will train. 
 Proficient skills creating and manipulating spreadsheet packages; Excel preferred but will train. 
 Knowledge of manufacturing processes especially as they relate to sheet metal, tooling, fixtures, jigs and assembly; and be able to integrate that knowledge into process flow and tool design assistance. 
 Reads and has a thorough understanding of Engineering Drawings and associated Parts Lists 
 Plan manufacturing operations to facilitate production of sheet metal parts 
 Create and maintain accurate Bill of Material (BOM) requirements for sheet metal parts 
 Update planning as required for all purchase order/customer engineering changes or for all method improvement/correction type changes. 
 Assist project engineer in coordinating with customer and supplier engineers to ensure that all data, information, drawings, and other necessary information is available to build quality parts. 
 Write detailed Statement of Work (SOW) that accurately defines the activities to be performed by suppliers. 
 Assist the Integrated Product Team Quality representative to develop a quality assurance/inspection plan for each part and Assembly. 
 Incorporate appropriate tolerances and specifications into all planning documents as described by the Purchase Order and Engineering Drawings. 
 Assist in writing detailed work instructions to accomplish job in a safe and satisfactory manner. 
 Coordinate the necessary information with other engineers to make corrections or improvements to planning, tooling, programs or processes. 
 Develop Standard Operating Procedures utilizing drawings and specifications as well as interviews with operators. 
 Participate in improvement activities with Manufacturing Engineer and Work Center Managers to support manufacturing operations. 
 Data collection and analysis for continuous improvement of production processes. 
 Propose process changes to improve quality and/or throughput. 
 Responsible for the proper handling and management of hazardous waste generated in their work area. 


Required Skills And Qualifications


 Ability to read, analyze and interpret scientific and technical data, blueprints, specifications, etc. 
 Ability to effectively present information to peers and management. 
 Ability to apply advanced mathematical and statistical concepts. 
 Ability to define problems, collect data, establish facts and draw valid conclusions. 
 Ability to interpret an extensive variety of technical instructions in mathematical or diagram form. 
 Ability to write reports, business correspondence, and procedure manuals 
 Must be able to communicate effectively. 
 The employee frequently is required to stand; the employee is occasionally required to walk and sit. 
 Specific vision abilities required by this job include close vision, distance vision, color vision, depth perception, and ability to adjust focus. 
 Must be able to occasionally move and/or lift from up to 25 pounds 


Required Experience And Education


 Current enrollment as an Engineering student – Mechanical, Aerospace, Systems or Process focus desired. 


Base Compensation: USD 18.00 - 23.00 Paid Hourly

Equal Opportunity Employer Veterans/Disabled

171 Stacey Road

Coxsackie, New York, 12051

United States

#dice",https://ducommun.csod.com/ux/ats/careersite/1/home/requisition/5090?c=ducommun&source=LinkedIn
AI/ML Engineering Intern ,Hitachi Energy,"The opportunity

As an AI/ML Engineering Intern in the IT Innovation Core Services team, you will support AI initiatives within the organization in cooperation with the IT Innovation & Technology department. Your role will involve assisting in the exploration and implementation of AI technologies, contributing to ongoing projects, and participating in the development of innovative AI solutions.

How You´ll Make An Impact


Support the development and testing of AI/ML prototypes and proof-of-concepts with technology leads.
Evaluate and benchmark new AI tools, frameworks, and vendor solutions for enterprise use.
Assist the IT AI Center of Excellence and Digital Quality Control teams in integrating AI capabilities.
Contribute to technical documentation and share findings with the innovation team.
Stay current with AI/ML advancements and propose relevant applications.


Your background


Currently pursuing a degree in Computer Science, Data Science, or a related technical field.
Practical understanding of AI/ML concepts and hands-on experience with relevant libraries.
Proficient in Python; familiarity with other programming languages is a plus.
Strong analytical and problem-solving skills with a focus on rapid prototyping.
Effective communicator and collaborative team player.
Proficient in English.


Hitachi Energy is a global technology leader that is advancing a sustainable energy future for all. We serve customers in the utility, industry and infrastructure sectors with innovative solutions and services across the value chain. Together with customers and partners, we pioneer technologies and enable the digital transformation required to accelerate the energy transition towards a carbon-neutral future.

We employ around 45,000 people in 90 countries who each day work with purpose and use their different backgrounds to challenge the status quo. We welcome you to apply today and be part of a global team that appreciates a simple truth: Diversity + Collaboration = Great Innovation.

www.hitachienergy.com

Hitachi Energy is an Equal Employment Opportunity (EEO) and Affirmative Action Employer encouraging diversity in the workplace. We welcome you to apply and want you to know that all qualified applicants will receive consideration for employment without regard to race, creed, color, ancestry, religion, sex, national origin, citizen status, age, sexual orientation, gender identity, disability, marital status, family medical leave status, protected veterans' status or any other legally protected characteristic. For more information regarding your EEO rights as an applicant, please visit the following websites here and here. Protected veterans and qualified individuals with a disability may request a reasonable accommodation if you are unable or limited in your ability to use or access Hitachi Energy career site as a result of your disability. You may request reasonable accommodations by calling a Hitachi Energy HR Representative at 1-888-504-2007 or by sending an email to: [email protected]. Resumes and applications will not be accepted in this manner.",https://www.hitachienergy.com/careers/open-jobs/details/JID3-142573?source=linkedin
Intern ,NTN Bearing Corporation,"#25-0489

Mount Prospect, Illinois, USA Job Description

Location: USA, Mount Prospect, IL - negotiable start and end dates

NTN USA Corporation is now offering an internship in our Information Technology department for the summer of 2025! Are you seeking to gain on the job experience and utilize your talents to their maximum potential? NTN is one of the world’s premier bearing manufacturers serving the automotive and industrial markets for over 100+ years.

Job Description:

The Information Technology Support Specialist will provide direct technical assistance and support to NBCA IT Staff for network, PC hardware and software issues. Duties include installing and maintaining software and hardware on desktops and laptops, meeting with staff to provide one-on-one technical assistance as needed/requested.

Essential Job Duties/Responsibilities:


Support PC hardware components, desktop operating system software, and application software through device imaging.
Assist in maintaining inventory records and documentation for equipment.
Respond to user requests for service, troubleshoot problems and help develop solutions.
Perform minor repairs to equipment and arrange for other servicing needs.
Identify and report system issues to vendors. Monitor and test resolution of those issues sent to vendors.
Monitor antivirus software and updates and repair computers infected with spyware, adware and/or viruses.
Applicants must have experience with Windows 10/11 in a technical support environment.
Applicants having experience in supporting recent versions of Microsoft Office applications is also a plus.


Requirements:


Must be pursuing an undergraduate or graduate level degree in Electrical and Electronics or Computer Science engineering related field. A GPA of 3.0 or above.
Must be available to work a minimum of 30-40 hours per week.
A basic understanding of computer network cabling and network file and print services.
Must be able to lift 25 pounds.


Requirements


Proficiency in the following computer applications:
Microsoft Excel – Manipulation of data; transferring data; development of charts and tables.
Microsoft Word – Entering and formatting text; inserting charts, tables, and other visuals.
Microsoft PowerPoint – Creating and editing slides; inserting text, charts, tables, and visuals.


NTN Bearing Corporation (NBCA) treats all employees and applicants according to their individual qualifications, abilities, and experiences and adheres to all local and national employment rules and regulations where we operate. NTN does not tolerate discrimination due to race, religion, color, national origin, sex, age, disability, protected veteran/military status, or any other legally protected trait.

If you are interested in this employment opportunity, please go to our website www.ntnamercas.com, click “careers” and apply.",https://myjobs.adp.com/ntnusajobs/cx/job-details?reqId=5001118634006&rb=LINKEDIN
Intern - Cincinnati ,"EMCOR Group, Inc.","About Us:

S.A. Comunale has been a local industry leader for end-to-end mechanical, fire protection and HVAC services for nearly 100 years.

We offer our clients significant financial strength, unmatched bonding capability, an award-winning safety program, and large-scale purchasing power.

With 15 locations and over 1,250 employees, including 600 skilled tradesmen throughout Ohio, Pennsylvania, New Jersey, Maryland, and West Virginia, S.A. Comunale can work in virtually every market sector and facility type.

Job Title: Intern

A Project Manager Intern will be assigned a mentor(s) to observe their functions and processes. They will assist the Project Manager mentor in overseeing all aspects of the project using planning, monitoring and controlling processes. A Project Manager Trainee will assist with the co-ordination and completion of multiple projects and to this end will aid in a variety of tasks including setting deadlines, assigning responsibilities, monitoring and summarizing progress of the project, and familiarizing themselves with required project reports and paperwork.

Essential Duties / Responsibilities:

Include the following. Other duties may be assigned.


Accurately define project requirements
Assist with creating job schedules
Coordinating the delivery of tools and fabrication
Identifying and managing the personnel assigned to each project and track their labor efficiency
Attend job progress meetings and initiating change orders and contract progress billings with the Project Manager.
Learn how to estimate remaining ""cost-to-complete"" for monthly WIP reporting.
Manage the day-to-day operations of assigned projects so that they are completed on time and on budget in correlation with the Project Manager.
Working with clients to brainstorm creative solutions to their problems and to ensure their needs are met through our customized solutions
Ensuring projects follows established guidelines that ensure they are completed as efficiently as possible
Communicating with team members regarding project needs
Ability to work in a fast-paced dynamic environment
Reading and analyzing job cost reports
Responding timely to inquiries from management
Assist with collections as required


Qualifications:

To perform this job successfully, the individual must be able to perform each essential duty satisfactorily. The requirements listed below are representative of the knowledge, skill, and/or ability required. Reasonable accommodations may be made to enable individuals with disabilities to perform the essential functions.

Education / Work Experience:


Recent graduate or currently enrolled full-time at an accredited university, pursuing a Bachelors degree in Construction Management, or other similar degree is required. Knowledge with sprinkler systems/plumbing and previous construction internship / experience a plus. Must have a basic understanding of key project management principles and construction processes required. 


Computer Skills:


Significant experience with Microsoft Office (i.e., Word, Excel, PowerPoint) applications. 


We offer our employees a competitive salary and comprehensive benefits package and are always looking for individuals with the talent and skills required to contribute to our continued growth and success. Equal Opportunity Employer/Veterans/Disabled.

Notice to prospective employees: There have been fraudulent postings and emails regarding job openings. EMCOR Group and its companies list open positions here. Please check our available positions to confirm that a post or email is genuine.

EMCOR Group and its companies do not reach out to individuals to help with marketing or other similar services. If an individual is contacted for services outside of EMCOR’s normal application process – it is probably fraudulent.",https://recruiting.ultipro.com/EMC1002EMCGI/JobBoard/cc563430-39f7-4c82-bdfe-62f295bd857a/OpportunityDetail?opportunityId=80b30dac-50fa-415d-86cc-46ea3169fd0a&source=LinkedIn
Software Developer Co-op/Intern ,London Computer Systems,"Are you a student software developer looking to improve your skills and work with a software development company? Do you thrive in an environment where you can learn hands-on?




LCS is seeking C# Software Development Co-Ops to join our team of developers. You’ll be on the cutting edge of technology as you play a pivotal role in the writing and design of website and desktop applications. Plus, you will learn invaluable lessons from being part of an award-winning team!

If you’re looking for a fulfilling software development internship opportunity, then apply today!




Responsibilities

Participate in web application development (including GUI design).
Produce efficient, clean, and well-commented code.
Analyze, design, test, and implement applications and databases.
Work closely with other teams, developers, and Senior Management to build new software features and applications.
Work with all User Interface, Application, and Database-related issues.




Preferred Qualifications

Experience with Object Oriented programming language (C# preferred)
Competency in developing modules independently
Excellent verbal and written communication skills
Ability to evaluate complex problems and arrive at a resolution
Ability to manage multiple projects simultaneously
Ability to thrive in a fast-paced environment
SQL/database experience
Excellent interface design skills
Experience with web and/or desktop applications
Experience with the full software development life cycle (SDLC)
Experience with WPF
Strong back-end development skills
Ability to explain complex technical information in simple language
Understanding of basic accounting concepts




About LCS

London Computer Systems (LCS), based in Cincinnati, Ohio, provides businesses with critical software and technology solutions. Since 2012, LCS has been consistently recognized as a Top Workplace with a supportive culture that fosters collaboration and authenticity. We also love having fun—from on-site food trucks and game rooms to trivia and sports teams, there are plenty of ways we make the workday exciting.

Candidates must live in the Greater Cincinnati area or be willing to relocate.

LCS is an Equal Opportunity Employer.

Applicants must be authorized to work for any employer in the U.S. We are unable to sponsor or take over sponsorship of an employment Visa at this time.

Email communications from LCS may appear in Junk, Spam, or Promotions (Gmail) email folders. We recommend checking all email folders while communicating with us.",https://workforcenow.adp.com/mascsr/default/mdf/recruitment/recruitment.html?cid=b156e713-5801-4c36-bb62-a62f3bc9844f&ccId=19000101_000001&type=MP&lang=en_US&jobId=534694
Engineering Intern ,BorgWarner,"Position

Functional Safety Engineering Support

Location

Auburn Hills, MI

About Us

BorgWarner is a global product leader in delivering innovative and sustainable mobility solutions for the vehicle market. We are a company of innovators and independent thinkers that brings together talented employees, meaningful work, and amazing technology in a unique environment. At BorgWarner we constantly work towards our vision of a clean and energy-efficient world.

Our Culture 

We believe health and safety of our employees are a top priority, we care about our local communities and the global environment. BorgWarner promotes and nurtures a diverse and inclusive environment, honors integrity, strives for excellence, commits to responsibility for our communities and the environment, and builds on the power of collaboration.

Career Opportunities 

We manage talent as seriously as we manage our businesses and encourage you to learn about our proud history, strong culture, technologies and future vision. We offer a strong local presence and interesting global opportunities. Start your future with BorgWarner now!

Job Purpose

BorgWarner PowerDrive Systems is currently looking for a “dynamic, results driven” individual to join our Functional Safety Team as Functional Safety Engineering Support at our Propulsion Technical Center (PTC) in Auburn Hills, MI.

Join us in developing state of the art safety solutions for hybrid and electric vehicles in a fast-paced marketplace

Key Responsibilities


Support the engineering team in the application of ISO 26262 at all levels (system, sub-system, component) for Hardware and Software
Support the functional safety engineers and safety engineer managers in developing the safety argumentation included in the safety case, as well as other required work products
Participate in enhance the functional safety processes with direct contributions to the optimization of methods (including templates) and guidance including automation and optimization of repetitive tasks
Participate in Peer Reviews, reviewing product Safety Requirements and Functional Safety specification of requirements among other safety work products including functional safety analysis (FMEDA and FTA)
Monitor FS KPIs (Functional Safety Key Performance Indicators)
Monitor Functional Safey Weekly Report Status
Monitor Status of Functional Safety Activities through Functional Safety Plans created by FSM
Monitor FS Work Product Findings and FS Project Defects and collaborate the drive to closure
Collaborate in ensuring traceability of safety requirements and design throughout the product lifecycle
Collaborate in the completion of verification reviews of safety work products
Knowledge of databases for requirements, issues tracking is a plus


What We’re Looking For


Student of a bachelor’s degree in electrical engineering, electronics engineering, mechanical engineering, automotive Engineering or physics required
Preference a student in his last or before last year prior graduation.
Interested in automotive system development (electrification preferred)
Interested in automotive drivetrain or propulsion systems is preferred
Organized and structured work style and attention to detail are required
Basic Knowledge of architecture engineering principles is a plus
Good PC knowledge of Microsoft Office tools required
Excellent verbal and written communication skills in English language required


What We Believe


Inclusion-We value diversity in people, ideas, and experiences. 
Integrity- We believe in transparency, authenticity, and depend on each other to deliver what we promise. 
 Excellence- We contribute to our developments by seeking knowledge and sharing information. 
 Responsibility- We care about our local communities and the global environment. 
Collaboration- We are one BorgWarner.


Safety 

This position will adhere to Global Star Safety Program, including safety rules, practices and training as outlined in the BorgWarner PTC Safety Policy Manual, which includes the use of equipment, protective devices, or clothing that the employer requires. This individual will work in manners that stress the importance of preventing accidents and illnesses. He/she must take every precaution reasonable in the given circumstance for the protection of themselves and coworkers. In addition, he/she is responsible for reporting all injuries and/or possible dangerous situations, incidents, or occurrences to the immediate supervisor.

Equal Employment Opportunity 

BorgWarner is an equal employment opportunity employer such that all qualified applicants will receive consideration for employment without regard to race, color, age, religion, sex, sexual orientation, gender identity/expression, national origin, disability or protected veteran status.

Visa Sponsorship 

BorgWarner does provide sponsorship for employment visa status based on business need. However, for this role, applicants must be currently authorized to work in the United States on a full-time basis.

No Unauthorized Referrals from Recruiters & Vendors 

Please note that BorgWarner and any of its affiliated companies does not seek or accept unsolicited resumes or offers from third party recruiters or staffing agencies associated with any published or unpublished employment opportunities. Any unsolicited information sent to BorgWarner will be considered as unencumbered and free from any fee or charge whatsoever. Only members of our Human Resources Team have the authority to engage or authorize recruiting services, which must be agreed upon before the unsolicited resume or offer is received.

Join the company that is creating solutions that support a cleaner, more energy-efficient world.

For more information about BorgWarner, please visit www.borgwarner.com

Internal Use Only Indirect Hourly

Global Terms of Use and Privacy Statement

Carefully read the BorgWarner Privacy Policy before using this website. Your ability to access and use this website and apply for a job at BorgWarner are conditioned on your acceptance and compliance with these terms.

Please access the linked document by clicking here, select the geographical area where you are applying for employment, and review. Before submitting your application you will be asked to confirm your agreement with the terms.

Career Scam Disclaimer  BorgWarner makes no representations or guarantees regarding employment opportunities listed on any third-party website. To protect against career scams, job applicants should take the necessary precautions when interviewing for and accepting employment positions allegedly offered by BorgWarner. Applicants should never provide their national ID numbers, birth dates, credit card numbers, bank account information or other private information when communicating with prospective employers or responding to employment opportunities online. Job applicants are invited to contact BorgWarner through BorgWarner’s website to verify the authenticity of any employment opportunities.",https://borgwarner.wd5.myworkdayjobs.com/BorgWarner_Careers/job/Auburn-Hills---Michigan---USA/Engineering-Intern_R2025-0223?source=LinkedIn
