title,company,description,url
Engineering Intern (App Team),PIP Labs,"About PIP Labs

PIP Labs is a research and engineering company at the forefront of decentralized technologies, intellectual property (IP), and artificial intelligence (AI). As a core contributor to the Story L1 blockchain, we’re building cutting-edge infrastructure and user-facing applications that empower creators, developers, and communities to own, remix, and monetize IP in radically new ways.

 The App Team 

Our App Team is focused on building intuitive, high-impact user experiences that bring the power of decentralized infrastructure to everyday creators. From web interfaces to protocol-integrated tools, we translate complex backend systems into beautiful, usable products.

 The Role 

We're looking for a highly motivated and curious Engineering Intern to join our App Team. You’ll work alongside experienced engineers and designers to help build, test, and deploy full-stack features across our web and mobile applications. This is a hands-on opportunity to contribute to real-world projects in the fast-moving world of web3, AI, and creative tooling.

What You'll Do


Contribute to the development of frontend features using React (and/or React Native) and modern web technologies
Build and integrate APIs, smart contract interfaces, and backend services
Write clean, testable, and well-documented code
Participate in team standups, design reviews, and code reviews
Collaborate with engineers, designers, and product managers to shape app functionality and user experience
Learn about blockchain, decentralized identity, token economies, and the future of digital ownership


What We're Looking For


Currently pursuing a degree in Computer Science, Software Engineering, or a related field
Solid understanding of JavaScript/TypeScript and web development fundamentals
Experience with NextJS, React, HTML/CSS, or similar frontend frameworks
Interest in web3, blockchain, or decentralized apps (no prior experience required, but a bonus!)
Strong problem-solving skills and a collaborative attitude
Curious, self-driven, and eager to learn in a fast-paced environment


Bonus Points


Experience with smart contracts (Solidity, Ethers.js , etc.)
Exposure to design systems or Figma
Passion for IP, open-source, or the creator economy


Why Intern at PIP Labs


Work on meaningful projects with real-world impact
Learn from a team of seasoned engineers, designers, and protocol researchers
Flexible remote environment with mentorship and growth opportunities
Get exposure to the cutting edge of blockchain, AI, and IP innovation",https://jobs.lever.co/piplabs/175d9c4e-5994-431e-bb59-3d0cf0aba42d/apply?source=LinkedIn
Data Engineering Intern,Hirist,"Data Engineering Intern (Remote – 3 Month Internship)

Company:

HIRIST – IT Recruitment Partner (Hiring for a Technology Client)

Location:

Remote

Job Type:

Internship | Remote | 3 Months




About the Role:

HIRIST is hiring Data Engineering Interns on behalf of a reputed IT client. This remote, part-time internship is ideal for individuals aiming to develop hands-on experience in managing and building data pipelines. Interns will work closely with the engineering and data teams to support the development of scalable data infrastructure and improve data reliability and accessibility.

Key Responsibilities:

Assist in building and maintaining efficient, scalable data pipelines.
Help with data ingestion, transformation, and integration processes.
Support ETL (Extract, Transform, Load) tasks using modern data tools.
Work with large datasets to optimize performance and quality.
Collaborate with data scientists and analysts to ensure data availability.

Required Qualifications:

Familiarity with SQL and relational databases.
Basic understanding of data structures and data modeling.
Good problem-solving and logical thinking skills.
Ability to work independently in a remote environment.

Preferred Qualifications:

Exposure to tools like Apache Airflow, Spark, or Kafka.
Basic experience with Python or Scala for scripting and automation.
Knowledge of cloud platforms like AWS, Azure, or GCP.
Previous academic or personal projects related to data pipeline development or big data handling.

Internship Details:

Duration: 3 months
Hours: 15–20 hours/week
Compensation: Paid internship (stipend provided)
Completion: Certificate of internship provided upon successful completion

Hiring Process:

Resume Screening
Basic Data Engineering Task
Virtual Interview with Project Team
Onboarding via HIRIST

Additional Information:

This is a fully remote position. A stable internet connection is essential.
HIRIST acts as a recruitment partner for a verified IT client.
The client organization's name will be disclosed to shortlisted candidates during the interview process.
There are no fees or charges at any stage of the hiring process.




Equal Opportunity Statement:

HIRIST is an equal opportunity recruitment partner. We welcome candidates from all backgrounds, regardless of race, gender, disability, or any protected characteristics.",https://www.hirist.us/talent-connect
"Intern, Research & Development",Lightera,"OFS has one of the longest and most respectable corporate lineages in American business, which goes back to Alexander Graham Bell and the invention of the telephone more than a century ago. We have a proven track record of being first in the industry with application specific fibers, optical connectors, ribbon cables, erbium doped fibers, Raman fiber lasers, fiber gratings and more. Our mission is to provide leading optical innovations and solutions by designing, manufacturing and supplying the best optical fibers, fiber cable and components and devices for our customers, with exceptional service that creates value for our shareholders, customers and employees. To do so, we must continue shaping the future of communications by applying the best minds to the challenges our customers will continually face.

We currently seek an intern working towards a bachelor’s degree in engineering to work in the Optical Fiber Research & Development organization in Norcross, GA.

The successful candidate will be working under the direction of Research & Development responsible for the planning and hands-on execution of new optical fiber development and process improvements. The assignment will involve development of automation solutions in a manufacturing environment. The successful candidate will gain valuable experience and improve his/her engineering skills and get exposure to a manufacturing environment. The position requires a student that is detail oriented and has a desire to work in a “hands-on” lab environment to develop solutions as well test the solutions in a manufacturing environment. This is a great opportunity for a focused, high achiever with excellent communication skills and demonstrated analytical and experimental skills. Applicants must be responsive, flexible, and able to succeed within a collaborative environment. A wide degree of creativity and autonomy is expected.

Essential duties and responsibilities include, but are not limited to:


Being paired with an engineer, manager and/or R&D resource to learn the process
Work with engineers on hardware design
Develop software to automate processes and test software in a lab environment
Create documentation for software and hardware design.


Key Qualifications Include


Pursuing a BS in Engineering. Electrical/Computer Engineering preferred
Programming experience in Python, C++ or C# are required
Experience with machine vision and building graphical user interfaces is helpful
Strong analytical and problem-solving skills
Strong communication, organization, and soft skills
Ability to work in a diverse team environment
Must be a self-starter and willing to work without constant direct supervision


Working at OFS means having the opportunity to realize ideas, experience innovation and discover new solutions for the future. In addition to our dynamic work environment, we offer competitive salaries and generous benefits programs, including medical, dental, tuition reimbursement and a matching 401(k) plan.

Employees are expected to serve as role models for safe work practices and behaviors. This includes following established health and safety policies and procedures, maintaining a clean, organized work area, wearing, and properly storing all personal protective equipment (PPE), and actively engaging as a safety conscious worker with personal safety and wellness as a priority.

If you’d like to be part of an energetic, world leader in optic fiber solutions, please apply online at www.ofsoptics.com/careers. Submissions must include salary information.

Note: Only those candidates selected for the interview process will be contacted.

 

OFS, a Georgia based global company, is an Equal Opportunity Employer. All qualified applicants will receive consideration for employment without regard to race, color, religion, sex, sexual orientation, gender identity, national origin, protected veteran status or status as an individual with a disability.",https://myjobs.adp.com/lighteracareers/cx/cx/job-details?reqId=5001030238800&rb=LINKEDIN
Engineering Intern ,Ribbon Communications,"Responsibilities

The Professional Services Intern will function as an assistant to various Ribbon engineers and shall carry the following responsibility:


Be assigned and complete projects designed to test and leverage intern’s skills obtained through graduate studies.
Identify and track new products/features, and interface with internal teams to ensure successful delivery to customers.
Review, test, and in some cases write procedures to be followed by service team members when delivering new products/features.
Assist in services focused testing of Ribbon products as necessary.
Assist in the installation and configuration of various servers received into the lab.
Learn and apply standard wiring practices to successfully interconnect installed servers to the lab IP network infrastructure.
Assist in the inventory management of Ribbon assets as required.


Qualifications


Currently enrolled in a University Degree seeking program for Electrical Engineering, Computer Science, Computer Engineering, Computer Information Systems, or other relevant technology focus programs.
Must be PC literate and well versed with Microsoft Office Suite of products (e.g. Word, Excel, Visio, Outlook and Teams)
Knows to ask questions to ensure assigned tasks and concepts are fully understood
The Intern will be expected to work in the office, especially during the learning phase, with the possibility to move to a hybrid office/remote working schedule once trained.
Ability to work on various operating systems such as Windows, UNIX & Linux is desired including an understanding of Perl/Python programming skills.
Understand basic principles of IP networking
Knowledge of cloud/hosted services and database concepts is a plus
Able to work safely with small hand tools
Possess strong research and good time management skills
Is an effective communicator, and proficient note taker


Please Note:

'All qualified applicants will receive consideration for employment without regard to race, age, sex, color, religion, sexual orientation, gender identity, national origin, protected veteran status, on the basis of disability, or other characteristic protected by applicable law.'

US Citizens and all other parties authorized to work in the US are encouraged to apply.",https://vhr-genband.wd1.myworkdayjobs.com/ribboncareers/job/USA-TX-Plano/Engineering-Intern_REQ-2025-2574?source=LinkedIn
Tech Intern ,PayCargo,"About PayCargo 

PayCargo is the trusted, global platform for logistics, helping businesses navigate the complexities of payments and invoice processing. Backed by deep industry knowledge and unrivaled AI technology, the solutions streamline financial workflows, improving transparency, and enhancing productivity.

With real-time payment capabilities and a network of 5,000+ vendors—including MSC, Maersk, ZIM, and leading air, rail, and terminal partners—PayCargo improves cash flow and ensures faster, more reliable cargo movement.

Headquartered in Coral Gables, Florida, we’re the leading digital platform for air and cargo payments in North America and expanding rapidly worldwide. In 2022, PayCargo raised $130 million in Series C funding from Blackstone Growth to support our vision of becoming the global standard for B2B freight payments.




About the role:

As a Tech Intern, you will have the opportunity to work alongside experienced professionals in a dynamic and fast-paced environment. This internship is designed to provide hands-on experience in various areas of technology, including software development, systems support, and data analysis. You will contribute to real-world projects, gain valuable technical skills, and have the chance to collaborate with cross-functional teams. Whether you are assisting with coding tasks, troubleshooting issues, or learning about emerging technologies, this role will give you a comprehensive understanding of the tech industry and help you grow as a future technology professional.




As the Tech Intern, you will:

Assist with coding, testing, and debugging software applications under the guidance of senior developers.
Support the troubleshooting and maintenance of systems, ensuring smooth operation.
Collaborate with cross-functional teams to analyze data and contribute to process improvements.
Participate in project meetings, offering fresh insights and ideas while learning from experienced team members.
Gain hands-on experience with the latest technologies and tools used in the tech industry.
Help document technical processes, procedures, and solutions to streamline operations.




Qualifications:

Currently pursuing a degree in Computer Science, Information Technology, Engineering, or a related field.
Strong interest in technology, software development, or data analysis.
Familiarity with programming languages such as Python, Java, or JavaScript (or willingness to learn).
Basic understanding of software development principles and methodologies.
Excellent problem-solving and analytical skills.
Strong communication and teamwork abilities, with a proactive attitude and willingness to learn.
Ability to manage time effectively and prioritize tasks in a fast-paced environment.




Preferred Skills:

Experience with version control tools like Git.
Familiarity with front-end technologies such as HTML, CSS, or JavaScript frameworks (React, Angular, etc.).
Knowledge of databases (SQL, NoSQL) and basic database management.
Exposure to cloud platforms (AWS, Azure, Google Cloud) and cloud-based technologies.
Understanding of Agile development processes and tools (Jira, Trello, etc.).
Experience with debugging and troubleshooting tools.
Ability to work independently and take initiative on projects.




What We Offer:

Our compensation package includes a highly competitive salary.

Your success at PayCargo is determined by the impact that you are making, and how well you collaborate with the various teams that you interact. Everyone at PayCargo is empowered to take ownership to learn, self-improve, and master their skills in an environment focused on efficiency, collaboration, and purpose.




We are proud to be an equal opportunity employer.

We are committed to equal employment opportunity regardless of race, color, ancestry, religion, sex, national origin, sexual orientation, age, marital status, disability, gender, gender identity or expression, or veteran status.",https://www.linkedin.com/jobs/search/?currentJobId=4250616437&f_TPR=r604800&geoId=103644278&keywords=software%20internship&origin=JOB_SEARCH_PAGE_JOB_FILTER&refresh=true
Software Test Automation Intern (Fall 2025) ,Zipline,"About Zipline

Zipline is on a mission to transform the way goods move. Our aim is to solve the world’s most urgent and complex access challenges by building the first instant logistics system that serves all humans equally. Leveraging expertise in robotics and autonomy, Zipline designs, builds, and operates a fleet of cutting edge, autonomous delivery drones. We serve tens of millions of people around the world.

Joining Zipline’s Emerging Talent program as an intern is an opportunity to contribute to our promise of building a system that provides equitable access to critical healthcare supplies for millions of people. We believe that internships are more than just opportunities to learn by watching or doing low level tasks. We expect our interns to take on meaningful work that actively contributes to moving Zipline’s mission forward, while learning real-world skills that will serve them in their careers for the long term.

Join us, and build the future of logistics with the best humans around!

About The Powertrain & Battery Team

Join Zipline’s Software Test Automation team and help build the systems that ensure our hardware is rock-solid—from prototype to production. You’ll write test software, automate hardware, analyze real-world data, and work directly with engineers and vendors to deploy systems on the manufacturing line. This is a hands-on role with real ownership, meaningful impact, and cross-functional collaboration from day one.

About The Role

Our interns contribute directly to the systems that keep Zipline’s hardware reliable and production-ready. Projects include:


Battery end-of-line (EOL) testing and data analysis
Distribution board functional testing
Motor testing at multiple levels—from PCBAs to full assemblies using dynamometers and wind tunnels
Building data pipelines with Snowflake to gather and present production insights to the Battery team and others
End-to-end test system development—from designing how a tester interfaces with the device under test (DUT), to writing automation software, to presenting test data for engineering use



You’ll work across hardware, software, and data—owning real systems that go into active use.

What You'll Do


Work with cross-functional teams in order to build a clear set of component and/or tester requirements
Architect and implement software to validate the design and assembly of components from circuit boards to large mechanical assemblies
Develop automation-centric software to streamline components testing, data collection and analysis
Gain a deep understanding of the components under test to become an expert on its expected and intended behavior under different conditions
Own a test asset through its entire lifecycle from planning and implementation to validation and analysis of results



What You'll Bring 


Experience programming in Python
Familiarity with using Linux
Experience developing software that interfaces directly with robotics, hardware, and instrumentation (forms of interprocess communication, CAN, TCP/IP, UDP)
Experience with motors and batteries
An understanding of basic electrical and/or mechanical principles
Demonstrates communicating technical information to peers clearly and without ambiguity
Experience coding in a local development environment
Experience navigating datasheets and writing basic drivers for new components



What Else You Need to Know 

Our internships are full-time positions, in-person at our South San Francisco office. We will host our Fall 2025 interns from September to December. 

The starting cash range for this role is $38 - 42 / hour. Please note that this is a target, starting cash range for a candidate who meets the minimum qualifications for this role. The final cash pay for this role will depend on a variety of factors, including a specific candidate's experience, qualifications, skills, and working location. The total compensation package for this role may also include: overtime pay; commuter benefits; paid sick time; and more.

Zipline is an equal opportunity employer and prohibits discrimination and harassment of any type without regard to race, color, religion, age, sex, national origin, disability status, genetics, protected veteran status, sexual orientation, gender identity or expression, or any other characteristic protected by federal, state or local laws or our own sensibilities.

We value diversity at Zipline and welcome applications from those who are traditionally underrepresented in tech. If you like the sound of this position but are not sure if you are the perfect fit, please apply!

Zipline is also committed to providing reasonable accommodations to individuals with disabilities. Please let your point of contact at Zipline know if you require any accommodations throughout your interview process.",https://www.zipline.com/careers/open-roles/6583613003
Firmware Development Engineering Intern - Fall 2025 ,Signify,"About Signify

Through bold discovery and cutting-edge innovation, we lead an industry that is vital for the future of our planet: lighting. Through our leadership in connected lighting and the Internet of Things, we're breaking new ground in data analytics, AI, and smart solutions for homes, offices, cities, and beyond.

At Signify, you can shape tomorrow by building on our incredible 125+ year legacy while working toward even bolder sustainability goals. Our culture of continuous learning, creativity, and commitment to diversity and inclusion empowers you to grow your skills and career.

Join us, and together, we’ll transform our industry, making a lasting difference for brighter lives and a better world. You light the way.

More about the role

This is an exciting job opportunity for you to light the way as a Firmware Development Engineering Intern in Atlanta, GA with Cooper Lighting Solutions, a business unit of Signify, the world leader in lighting.


Develop FW for embedded IoT lighting system deployed worldwide
Collaborate with other engineers and departments to meet customer requirements
Create, test, debug and support sensors and controllers for the leader in lighting controls


More about you

Skills

While we value and appreciate all applicants, we believe that the following experience and skills will be needed to shine brightly in this job opening:


Currently pursuing a bachelors or master’s degree in computer engineering or related field
Interested in embedded FW and microcontroller development
Knowledge of FW development principles, interfaces and protocols
Ability to work in team environment and on individual assignments
Must be legally authorized to work in the United States without current or future company sponsorship needs


Everything we’ll do for you

You can grow a lasting career here. We’ll encourage you, support you, and challenge you. We’ll help you learn and progress in a way that’s right for you, with coaching and mentoring along the way. We’ll listen to you too, because we see and value every one of our 30,000+ people.

We believe that a diverse and inclusive workplace fosters creativity, innovation, and a full spectrum of bright ideas. With a global workforce representing 99 nationalities, we are dedicated to creating an inclusive environment where every voice is heard and valued, helping us all achieve more together.

This internship could lead to an at will full-time role in Signify.

Pay Rate: $23 - $31 per hour (based on year of study)

Benefits Overview: Company subsidized benefits plan offerings that includes Medical and a Health Savings Account.

Come join us, and together we can light the way.",https://www.careers.signify.com/global/en/job/359265/?utm_source=linkedin&utm_medium=jobposting&utm_campaign=linkedin_jobwrapping
2024 Tech Intern Pool ,Guidepoint,"Looking for summer internship in Technology?




You will have the opportunity to work within our Engineering department in one of our four U.S. locations (New York, Boston, Phoenix, San Francisco). This is a paid 10-week internship commencing in early June. Job Description and further details forthcoming, in the meantime, please share the requested information.




If the Guidepoint Talent Acquisition Team finds your background to be of interest, we will reach out for a brief exploratory call to learn more about you and share our story. We look forward to hearing from you!",https://job-boards.greenhouse.io/guidepoint/jobs/6952196002?gh_src=a2920eab2us
