title,company,description,url
Software Engineering Intern,Jobs via Dice,"Dice is the leading career destination for tech experts at every stage of their careers. Our client, Kforce Technology Staffing, is seeking the following. Apply via Dice today!

RESPONSIBILITIES:

Kforce has a client in Carlsbad, CA that is seeking a Software Engineering Intern.

Responsibilities:


 Report and provide support to the Director of Optical Communications
 Assist in designing and executing experiments
 Provide software development, product development, material ordering and general administrative tasking support


REQUIREMENTS:


 Willingness to learn
 Currently Enrolled in college program
 Ability to adapt to changing requirements
 Ability to work onsite in Carlsbad, CA


The pay range is the lowest to highest compensation we reasonably in good faith believe we would pay at posting for this role. We may ultimately pay more or less than this range. Employee pay is based on factors like relevant education, qualifications, certifications, experience, skills, seniority, location, performance, union contract and business needs. This range may be modified in the future.

We offer comprehensive benefits including medical/dental/vision insurance, HSA, FSA, 401(k), and life, disability & ADD insurance to eligible employees. Salaried personnel receive paid time off. Hourly employees are not eligible for paid time off unless required by law. Hourly employees on a Service Contract Act project are eligible for paid sick leave.

Note: Pay is not considered compensation until it is earned, vested and determinable. The amount and availability of any compensation remains in Kforce's sole discretion unless and until paid and may be modified in its discretion consistent with the law.

This job is not eligible for bonuses, incentives or commissions.

Kforce is an Equal Opportunity/Affirmative Action Employer. All qualified applicants will receive consideration for employment without regard to race, color, religion, sex, pregnancy, sexual orientation, gender identity, national origin, age, protected veteran status, or disability status.

By clicking ?Apply Today? you agree to receive calls, AI-generated calls, text messages or emails from Kforce and its affiliates, and service providers. Note that if you choose to communicate with Kforce via text messaging the frequency may vary, and message and data rates may apply. Carriers are not liable for delayed or undelivered messages. You will always have the right to cease communicating via text by using key words such as STOP.",https://click.appcast.io/t/q8LcP6W8kzZgt-nOuJzyxPGQT9tGUZCKsID3t_w5McU=
Research and Development Intern ,CTEH,"A CTEH R&D Intern will support research and development initiatives in machine learning, computer vision, and robotics applications under the guidance of our experienced R&D team. This position offers hands-on experience with cutting-edge technologies in environmental response and industrial automation.

Job Type: Temporary/Part Time

Salary Range: $16-$20 per hour (commensurate with experience)

ACTIVITIES/TASKS/SCOPE


Work closely with the Director of R&D to develop and test machine learning models for environmental data analysis and prediction
Assist in designing and implementing computer vision solutions for field assessment and monitoring applications
Support robotics projects including sensor integration, path planning, and autonomous system development
Contribute to data collection, preprocessing, and annotation for training ML models
Participate in prototyping and proof-of-concept development for innovative R&D initiatives
Conduct literature reviews and research on emerging technologies in ML, CV, and robotics
Document experimental procedures, results, and technical specifications
Collaborate with cross-functional teams to integrate R&D solutions into operational workflows
Performs such other duties as are assigned


Other Desired Competencies


Ability to work overtime on occasion;
Ability to maintain confidentiality and the highest degree of professionalism;
Ability to multi-task, prioritize and meet deadlines;
Possesses excellent problem-solving and analytical skills with significant amount of information;
Ability to remain calm when dealing with imperfect information and ambiguity;
Ability to understand and follow written and verbal directions;
Possesses strong computer skills in a Windows-based environment and strong knowledge of the Microsoft Office Suite; and, 
Possesses excellent verbal and written communication skills in the English language.


Education/Experience


Currently enrolled in an undergraduate or graduate program in Computer Science, Robotics, Electrical Engineering, Computer Engineering, or related technical field.
Coursework or projects in machine learning, computer vision, or robotics strongly preferred.
Demonstrated interest in applied research and technology development.


PHYSICAL DEMANDS & WORK ENVIRONMENT

The physical demands described below are representative of those that must be met by an employee to successfully perform the essential functions of this job. Reasonable accommodations may be made to enable individuals with disabilities to perform the essential functions.


Sitting, standing, and walking
Infrequently lifting up to 25 pounds and infrequent overhead lifting of over 25 pounds
Bending, climbing and stooping
Keyboarding/typing
Ability to read effectively from a computer screen and/or a paper copy.
Ability to handle a large volume of work and perform multiple tasks in a fast-paced environment


The work environment characteristics described here are representative of those an employee encounters while performing the essential functions of this job. Reasonable accommodations may be made to enable individuals with disabilities to perform the essential functions.


Works in an office environment;
May on occasion work outdoors and may be exposed to hot and cold environments and extreme weather conditions, including sunlit, rainy and windy conditions;
May encounter environments presenting physical hazards of uneven ground, standing water, ditches, dusty conditions, rapidly moving transportation and remediation equipment, and physical stress associated with the wear of personal protective equipment;
May work at altitudes greater than 5000 feet above sea level;
May work on land, sea, or air;
May work in a setting with potential physical and chemical hazards; and",https://montrose.wd1.myworkdayjobs.com/CTEH/job/USA-AR-Little-Rock--Northshore-Dr/Research-and-Development-Intern_R7049?source=LinkedIn
Engineering Intern ,Element Materials Technology,"Overview

Element has an opportunity for an Engineering Intern to join our Cincinnati team. This is a great opportunity to develop your skills within a Global TIC business and learn how we impact the Aerospace industry.

Salary: $20- $23/hr DOE

Responsibilities


 Essential duty is to support daily activities for all Aerospace departments
 Fatigue data input: Analyze LCF data, Lims data entry, and frame input
 Fatigue crack growth measurements – perform and develop improved process
 Run machining and testing equipment
 Project management/coordination
 Client communication
 Review and update current processes and equipment
 Develop new testing methods
 Excel template validation/creation
 Develop and maintain training manuals and TPM information
 Performing general duties in accordance with Element's internal procedures, quality as well as Health and Safety system


Skills / Qualifications


 Enrolled in Aerospace Engineering, Mechanical Engineering, Industrial and Systems Engineering, or Materials Engineering college courses
 Hands-on job
 Sound mechanical bias
 Self-motivated with the ability to multitask, organize and work under the pressure of a busy commercial mechanical test laboratory
 Excellent attention to detail
 Strong written and verbal communication skills
 A team player attitude
 Excellent analytical and problem-solving skills


Company Overview

Element is one of the fastest growing testing, inspection and certification businesses in the world. Globally we have more than 9,000 brilliant minds operating from 270 sites across 30 countries. Together we share an ambitious purpose to ‘Make tomorrow safer than today’.

When failure in use is not an option, we help customers make certain that their products, materials, processes and services are safe, compliant and fit for purpose. From early R&D, through complex regulatory approvals and into production, our global laboratory network of scientists, engineers, and technologists support customers to achieve assurance over product quality, sustainable outcomes, and market access.

While we are proud of our global reach, working at Element feels like being part of a smaller company. We empower you to take charge of your career, and reward excellence and integrity with growth and development.

Industries across the world depend on our care, attention to detail and the absolute accuracy of our work. The role we have to play in creating a safer world is much bigger than our organization.

 Diversity Statement 

At Element, we always take pride in putting our people first. We are an equal opportunity employer that recognizes diversity and inclusion as fundamental to our Vision of becoming “the world’s most trusted testing partner”.

All suitably qualified candidates will receive consideration for employment on the basis of objective work related criteria and without regard for the following: age, disability, ethnic origin, gender, marital status, race, religion, responsibility of dependents, sexual orientation, or gender identity or other characteristics in accordance with the applicable governing laws or other characteristics in accordance with the applicable governing laws.

The contractor will not discharge or in any other manner discriminate against employees or applicants because they have inquired about, discussed, or disclosed their own pay or the pay of another employee or applicant. However, employees who have access to the compensation information of other employees or applicants as a part of their essential job functions cannot disclose the pay of other employees or applicants to individuals who do not otherwise have access to compensation information, unless the disclosure is (a) in response to a formal complaint or charge, (b) in furtherance of an investigation, proceeding, hearing, or action, including an investigation conducted by the employer, or (c) consistent with the contractor’s legal duty to furnish information. 41 CFR 60-1.35(c)

“If you need an accommodation filling out an application, or applying to a job, please email Recruitment@element.com ”",https://element-ext-us.icims.com/jobs/16650/engineering-intern/login?hub=11&in_iframe=1
Software Developer Intern | Vokey Wedges ,Acushnet Company,"Where Performance Meets Purpose

Join a team that values excellence and innovation, at a company known for its iconic golf brands. At Acushnet Company, your background and experience contribute to creating the best products for dedicated golfers worldwide. Here, your performance has purpose.

What You Will Do

Step into the world of global eCommerce innovation as a Software Developer Intern on our dynamic digital team. You'll work alongside experienced developers, gaining hands-on experience with technologies like .NET, JavaScript, and CMS/OMS platforms. From coding and testing new features to integrating APIs and enhancing customer experiences, you’ll contribute to impactful projects that shape the future of online retail. This is your opportunity to learn, grow, and make a real difference in a fast-paced, collaborative environment.

What You Will Bring


Pursuing a degree in Computer Science, Engineering, or a related field
Familiarity with programming languages such as C#, JavaScript, or Python
Basic understanding of web technologies (HTML, CSS, ASP.NET a plus)
Exposure to eCommerce platforms, API integration, or cloud solutions
Detail-oriented and self-motivated
Strong communication and teamwork skills
Eager to learn and thrive in a fast-paced environment


Our Commitment to You

At Acushnet Company, we are committed to helping our associates thrive both personally and professionally. From the start, you and your family, including domestic partners, will benefit from a comprehensive suite of health and well-being programs. Enjoy the advantages of paid time off, an onsite fitness center, acupuncture, physical therapy, wellness coaches, and more.

Our financial benefits are designed to secure your future, offering a 401k with company match, health savings accounts, and flexible spending accounts.

Additionally, you'll enjoy perks like pet insurance, legal planning, education assistance, and exclusive access to our Associate Store. At Acushnet Company, your performance has purpose, and we're here to support you every step of the way.

Ready to Make an Impact?

Join us at Acushnet Company and be part of a team that values excellence and innovation.

EEO And Additional Statements


Acushnet Company is an equal opportunity employer. All qualified applicants will receive consideration for employment without regard to race, religion, color, national origin, sex, sexual orientation, age, status as a protected veteran, among other things, or status as a qualified individual with a disability. EEO Employer/Vet/Disabled.
Acushnet Company respects the intellectual property and confidential information of third parties. Our policy is that no employee or applicant shall disclose confidential information of a third party to Acushnet Company. Accordingly, please do not include any confidential information of a current or previous employer on your resume or any other materials you provide to us.
Acushnet Company participates is E-Verify. Please click here for more details.
Privacy Notice link",https://acushnetgolf.wd12.myworkdayjobs.com/ACU/job/Carlsbad-California-United-States-of-America/Software-Developer-Intern---Vokey-Wedges_Req100055?source=LinkedIn
Software Engineer Intern ,Sony Electronics,"Sony Electronics Inc. is looking for the risk-takers, the collaborators, the inspired and the inspirational. We want the people who are brave enough to work at the cutting edge and create solutions that will enrich and improve the lives of people across the globe. In addition to competitive pay and benefits, we offer an environment and culture that promotes Diversity, Equity and Inclusion. In addition, our team members enjoy innovative work-life balance opportunities including a hybrid home/office workplace, monthly “Free Fridays”, and early shutdowns on Fridays throughout the year (including half-days during the summer).

So, if you want to join a “Best Place to Work” company and make the world say wow, let's talk.

We are looking for an aspiring developer with interest in developing applications that can have a real impact on products used by millions of customers!

The ideal internship candidate finds software engineering fun, loves learning new frameworks and languages, and is fastidious about their code. Using and/or contributing to open-source projects is a big plus, as well as experience with unit testing code, continuous integration and test-driven development.

This position is based at Sony Electronics U.S. Headquarters, located in San Diego, CA.

In this role, you will gain hands on experience in software development activities, such as:


Developing & Maintaining Cloud Services: Build scalable, high-performance APIs and backend services in a cloud environment.
Automation & Optimization: Create scripts and tools to streamline deployment, testing, and monitoring workflows.
Containerizing Infrastructure: Design and manage Docker-based solutions for portable, reproducible development and production environments. 
Leveraging ML/AI for Insights: Implement monitoring and analytics pipelines that use machine learning and AI to surface system health and usage trends.
Building User Interfaces: Design and code intuitive web portals and dashboards for enterprise management applications.


Internship Qualifications


Currently enrolled as an undergraduate or graduate student studying Software Engineering or related field with applicable coursework
Experience building web services and applications with Golang, Rust, NodeJS, MySQL, Vue, React
Familiarity with Linux and shell languages
Experience with client-server architecture and web services
Strong interest in pursuing a design and development career path
AWS, Docker, and CI/CD experience preferred


Sony Electronics is an Equal Opportunity Employer that values employees with a broad cross-cultural perspective. We strive to create an inclusive environment, empower employees and embrace diversity. We encourage everyone to respond. All applicants will receive fair and impartial treatment without regard to race, color, religion, sex, national origin, ancestry, citizenship status, age, legally protected physical or mental disability, protected veteran status, status in the U.S. uniformed services, sexual orientation, gender identity or expression, marital status, genetic information or on any other basis which is protected under applicable federal, state or local law.

Disability Accommodation for Applicants to Sony Electronics Inc. and Sony of Canada ULC.

Sony Electronics Inc. and Sony of Canada Ltd. provides reasonable accommodation for qualified individuals with disabilities and disabled veterans in job application procedures. For reasonable accommodation requests, please contact us by email at talenthelp@am.sony.com, or you can mail your resume to: Sony Electronics, Human Resources Department, 16535 Via Esprillo, San Diego CA 92127. Please indicate the position you are applying for.

EEO is the Law

EEO is the Law Supplement

Right to Work (English/Spanish)

E-Verify Participation (English/Spanish)",https://sonyglobal.wd1.myworkdayjobs.com/SonyGlobalCareers/job/San-Diego/Software-Engineer-Intern_JR-117822?source=LinkedIn
Software Engineer Intern (SaaP) ,CooperSurgical,"Essential Functions

 JOB DESCRIPTION 


Assist Software Engineering with design, development and verification of medical devices.
Perform unit tests, integration tests, document analyze results.
Write test plans and reports.
Program/Code/Develop software applications, test applications and document the design.
Perform troubleshooting tasks in simple to complex software applications.
Prototype software applications and user interface design.
Detect manual steps in current workflow and automate for efficiency in process.



Scope


The R&D department is looking for Engineering students in Software, IT or related tracks who are motivated to build and expand their real-world skills in a dynamic product development setting. The R&D interns will assist with the product development and software engineering processes. Interns will work on relevant in-process engineering projects during their time with the company.



Knowledge, Skills And Abilities


Intermediate skill in the use of Excel, Word and PowerPoint. Advanced preferred.
Well organized with attention to detail and ability to carry out tasks independently.
Excellent project management, organizational and follow-through skill set.
Strong communication and interpersonal skills.
Professional demeanor.
Ability to program C, C++, MATLAB, python and/or any high-level programming language.
Ability to read, write and understand software design documents, software requirements documents.
Ability to recreate, troubleshoot and fault find software defects.
Familiarity with technologies like Cloud, AI, ML etc.



Experience


Not required, but prior Internship experience is a plus.



Education

Current college student, majoring in Computer Science, or related tracks, entering their Sophomore, Junior, Senior year or Masters.


Minimum 3.0 GPA.



We are committed to equal employment opportunity regardless of race, color, ancestry, religion, sex, national origin, sexual orientation, age, citizenship, marital status, disability, gender, gender identity or expression, or veteran status. We are proud to be an equal opportunity workplace.",https://hcjy.fa.us2.oraclecloud.com/hcmUI/CandidateExperience/en/sites/CX_1/job/7981?utm_medium=jobshare
Student - Automation Intern ,Linamar Corporation,"Job Description

Job Title: Automation Student 

Reporting to the Engineering Supervisor and working closely with Controls Engineer and Technicians you will be hands on in your projects. Spending much of your time on the shop floor you will be working on projects including cycle time studies, automation cell layouts and small end of arm tool designs as well as work instructions and documentation.

Powering Vehicles, Motion, Work, and Lives since 1966.

Performance Expectations


 Support Program Managers/Controls Engineers with standard work instructions (SWI) as necessary.
 Create fully detailed engineering drawings that contain all necessary information from required specifications (Electrical schematics).
 Assist with automation cell designs and drawings.
 Work with Controls Technicians to assist in troubleshooting issues with machine operation to detect malfunctions, and adjusts/replace machine hardware as required.
 Perform and document machine TAKT Time capability studies.


Credentials


 Enrolled in an mechanical, electrical, industrial system or mechatronics program
 Ability to work in AutoCAD, SolidWorks or related 3D engineering modeling software
 Good report writing skills


Desired Characteristics


 Ability to read electrical schematics, blueprints, pneumatic/hydraulic systems and OEM machine documentation.
 Knowledge of robot systems (ABB, Fanuc, Kuka).
 Basic knowledge of computer networking, Ethernet connections, TCP/IP protocol.
 Knowledge of basic PLC programming including Allen-Bradley, ControlLogix/RS Logix, Siemens S7, Fanuc.
 Ability to provide technical support and services to engineers.
 Ability to evaluate condition of new and damaged mechanical equipment and make recommendations for repair or replacement.
 Ability to perform root cause analysis failure.
 Ability to work in design stage of processes both for start-up and current production projects.
 Ability to troubleshoot process automation problems.
 Ability to work in a team environment to share opinions with co-workers, colleagues and peers about successful projects, problematic projects and design techniques.
 Ability to use problem solving and analytical skills to compare real world problems to intended operations.
 Ability to absorb new information and learn about technological advances from daily work activities, training offered by software companies, and trade associations, and through personal reading and study using trade publications, company newsletters, manuals, books, regulations and websites.


 What Linamar Has to Offer 

Competitive Compensation 

Employee Benefits package includes but not limited to, Medical, Dental & Vision etc. 

Opportunities for career advancement. 

Community based outreach supporting both local and global initiatives and charities. 

Discounts for local vendors and events, including auto supplier discounts. 

About Us 

Linamar Corporation is a Canadian-founded global manufacturer, renowned for its advanced engineering and innovative product development across diverse industries and markets. Our journey started in 1966 under the visionary leadership of our founder, and today, we remain committed to cultivating a culture of innovation and collaboration. 

With access to state-of-the-art tools and resources, you'll have the opportunity to make a meaningful impact alongside a team of driven and passionate professionals. Join us and be part of a company where innovation, collaboration, and growth are at the heart of everything we do.

LNC3795831747",https://fa-epmd-saasfaprod1.fa.ocs.oraclecloud.com/hcmUI/CandidateExperience/en/sites/CX_3001/job/11235?utm_medium=jobboard&utm_source=linkedin
